{
  "food_id": "usda_173950",
  "name": "Blueberries, raw",
  "description": "Raw blueberries (Vaccinium spp.), edible fruit portions",
  "category": "Fruits",
  "serving_info": {
    "serving_size": 100,
    "serving_unit": "g",
    "household_serving": "1 cup (148g)"
  },
  "standard_nutrients": {
    "calories": 57.0,
    "protein_g": 0.74,
    "carbohydrates_g": 14.49,
    "fat_g": 0.33,
    "fiber_g": 2.4,
    "sugars_g": 9.96,
    "calcium_mg": 6.0,
    "iron_mg": 0.28,
    "magnesium_mg": 6.0,
    "phosphorus_mg": 12.0,
    "potassium_mg": 77.0,
    "sodium_mg": 1.0,
    "zinc_mg": 0.16,
    "vitamin_c_mg": 9.7,
    "vitamin_a_iu": 54.0
  },
  "brain_nutrients": {
    "vitamin_b6_mg": 0.052,
    "folate_mcg": 6.0,
    "vitamin_b12_mcg": 0.0,
    "vitamin_d_mcg": 0.0,
    "magnesium_mg": 6.0,
    "zinc_mg": 0.16,
    "iron_mg": 0.28,
    "selenium_mcg": 0.1,
    "choline_mg": 6.0,
    "tryptophan_mg": 7.4,
    "tyrosine_mg": 8.6,
    "omega3": {
      "total_g": 0.09,
      "epa_mg": 0.0,
      "dha_mg": 0.0,
      "ala_mg": 90.0,
      "confidence": 6.8
    }
  },
  "bioactive_compounds": {
    "polyphenols_mg": 836.0,
    "flavonoids_mg": 180.8,
    "anthocyanins_mg": 163.3,
    "carotenoids_mg": 0.12,
    "probiotics_cfu": 0,
    "prebiotic_fiber_g": 1.3
  },
  "mental_health_impacts": [
    {
      "impact_type": "cognitive_enhancement",
      "direction": "positive",
      "mechanism": "Anthocyanins and other flavonoids reduce neuroinflammation and oxidative stress in the brain, while improving blood flow to cognitive regions",
      "strength": 7,
      "confidence": 8,
      "time_to_effect": "both_acute_and_cumulative",
      "research_context": "Multiple human RCTs show improved memory and executive function, particularly in older adults",
      "research_support": [
        {
          "citation": "Krikorian R, et al. Blueberry supplementation improves memory in older adults. J Agric Food Chem. 2010;58(7):3996-4000.",
          "doi": "10.1021/jf9029332",
          "study_type": "randomized controlled trial",
          "year": 2010
        },
        {
          "citation": "Miller MG, et al. Dietary blueberry improves cognition among older adults in a randomized, double-blind, placebo-controlled trial. Eur J Nutr. 2018;57(3):1169-1180.",
          "doi": "10.1007/s00394-017-1400-8",
          "study_type": "randomized controlled trial",
          "year": 2018
        }
      ]
    },
    {
      "impact_type": "mood_elevation",
      "direction": "positive",
      "mechanism": "Polyphenols and vitamin C reduce oxidative stress and inflammation associated with depressive symptoms; flavonoids modulate neurotransmitter systems",
      "strength": 5,
      "confidence": 6,
      "time_to_effect": "cumulative",
      "research_context": "Observational studies show associations between berry consumption and reduced depression risk; limited intervention studies",
      "research_support": [
        {
          "citation": "Chang SC, et al. High anthocyanin intake is associated with a reduced risk of depression in middle-aged and older women. J Nutr. 2022;152(2):505-514.",
          "doi": "10.1093/jn/nxab387",
          "study_type": "prospective cohort",
          "year": 2022
        }
      ]
    },
    {
      "impact_type": "stress_reduction",
      "direction": "positive",
      "mechanism": "Antioxidants in blueberries help reduce cortisol production and mitigate physiological stress responses",
      "strength": 4,
      "confidence": 5,
      "time_to_effect": "cumulative",
      "research_context": "Limited human studies, some evidence from animal models",
      "research_support": [
        {
          "citation": "Williams CM, et al. Blueberry-induced changes in spatial working memory correlate with changes in hippocampal CREB phosphorylation and brain-derived neurotrophic factor (BDNF) levels. Free Radic Biol Med. 2008;45(3):295-305.",
          "doi": "10.1016/j.freeradbiomed.2008.04.008",
          "study_type": "animal study",
          "year": 2008
        }
      ]
    }
  ],
  "data_quality": {
    "completeness": 0.89,
    "overall_confidence": 8,
    "brain_nutrients_source": "usda_provided",
    "impacts_source": "literature_review"
  },
  "metadata": {
    "version": "0.1.0",
    "created": "2025-04-25T10:30:00Z",
    "last_updated": "2025-04-25T10:30:00Z",
    "source_urls": [
      "https://fdc.nal.usda.gov/fdc-app.html#/food-details/173950/nutrients",
      "https://pubmed.ncbi.nlm.nih.gov/20047325/",
      "https://pubmed.ncbi.nlm.nih.gov/28260263/"
    ],
    "image_url": "https://example.com/images/blueberries.jpg",
    "tags": ["berries", "antioxidant-rich", "brain-food", "anti-inflammatory"]
  }
}