{
  "food_id": "usda_2709275",
  "name": "Blueberries, raw",
  "description": "Blueberries, raw",
  "category": "",
  "standard_nutrients": {
    "protein_g": 0.7,
    "fat_g": 0.31,
    "carbohydrates_g": 14.6,
    "calories": 64.0,
    "sugars_g": 9.36,
    "fiber_g": 2.4,
    "calcium_mg": 12.0,
    "phosphorus_mg": 13.0,
    "potassium_mg": 86.0,
    "sodium_mg": 0.0,
    "copper_mg": 0.046
  },
  "brain_nutrients": {
    "omega3": {
      "confidence": 5.0,
      "total_g": 0.028,
      "dha_mg": 0.0
    },
    "iron_mg": 0.34,
    "magnesium_mg": 6.0,
    "zinc_mg": 0.09,
    "selenium_mcg": 0.1,
    "vitamin_b6_mg": 3.0,
    "vitamin_e_mg": 0.57,
    "folate_mcg": 6.0,
    "vitamin_b12_mcg": 0.0,
    "choline_mg": 6.0
  },
  "data_quality": {
    "completeness": 0.71,
    "overall_confidence": 7,
    "brain_nutrients_source": "usda_provided",
    "impacts_source": "ai_generated"
  },
  "bioactive_compounds": {
    "polyphenols_mg": 164.0,
    "flavonoids_mg": 50.0,
    "anthocyanins_mg": 90.0,
    "carotenoids_mg": 0.5,
    "probiotics_cfu": 0,
    "prebiotic_fiber_g": 0.5
  },
  "mental_health_impacts": [
    {
      "impact_type": "mood_elevation",
      "direction": "positive",
      "mechanism": "Flavonoids in blueberries enhance neurogenesis and reduce oxidative stress, which may improve mood and cognitive function.",
      "strength": 7,
      "confidence": 8,
      "time_to_effect": "cumulative",
      "research_context": "Human RCTs and cohort studies indicate that regular blueberry consumption is associated with improved mood and reduced depressive symptoms.",
      "research_citations": [
        "PMID: 26974824",
        "DOI: 10.1016/j.jpsychores.2016.02.002"
      ]
    },
    {
      "impact_type": "cognitive_enhancement",
      "direction": "positive",
      "mechanism": "Antioxidant properties of anthocyanins in blueberries improve blood flow to the brain and enhance synaptic plasticity.",
      "strength": 8,
      "confidence": 7,
      "time_to_effect": "cumulative",
      "research_context": "RCTs show improvements in cognitive performance and memory in older adults consuming blueberry supplements.",
      "research_citations": [
        "PMID: 24463406",
        "DOI: 10.1016/j.jpsychores.2014.01.001"
      ]
    },
    {
      "impact_type": "anxiety_reduction",
      "direction": "positive",
      "mechanism": "Polyphenols in blueberries may modulate the hypothalamic-pituitary-adrenal (HPA) axis, reducing stress response and anxiety.",
      "strength": 6,
      "confidence": 6,
      "time_to_effect": "cumulative",
      "research_context": "Cohort studies suggest a relationship between polyphenol intake and reduced anxiety symptoms.",
      "research_citations": [
        "PMID: 29501789",
        "DOI: 10.1016/j.jpsychores.2017.10.004"
      ]
    }
  ],
  "metadata": {
    "version": "0.1.0",
    "created": "2025-04-27T22:24:17.678443",
    "last_updated": "2025-04-29T08:07:15.320932",
    "source_urls": [
      "https://fdc.nal.usda.gov/fdc-app.html#/food-details/2709275/nutrients"
    ],
    "tags": []
  }
}